,Header,Link
0,NBA free agency 2023: Damian Lillard's agent reportedly cautioning teams from trading for star guardYahoo Sports,https://sports.yahoo.com/nba-free-agency-2023-damian-lillards-agent-reportedly-cautioning-teams-from-trading-for-star-guard-193736319.html
1,"NHL free agency 2023 tracker: Filip Zadina, Red Wings mutually terminate contractYahoo Sports Canada",https://sports.yahoo.com/nhl-free-agency-2023-tracker-filip-zadina-red-wings-mutually-terminate-contract-160548526.html
2,Sha'Carri Richardson's quest for redemption among top stories to follow at 2023 USA Track and Field ChampionshipsYahoo Sports,https://sports.yahoo.com/shacarri-richardsons-quest-for-redemption-among-top-stories-to-follow-at-2023-usa-track-and-field-championships-190016063.html
3,"All-Stars Breanna Stewart, Napheesa Collier planning to start U.S. offseason 3-on-3 league for WNBA playersYahoo Sports",https://sports.yahoo.com/all-stars-breanna-stewart-napheesa-collier-planning-to-start-us-offseason-3-on-3-league-for-wnba-players-190059905.html
4,"UFC schedule: Fight cards, times, locations, odds and how to watch, including UFC 290 – Volkanovski-RodriguezYahoo Sports",https://sports.yahoo.com/ufc-schedule-fight-cards-times-locations-odds-and-how-to-watch-including-ufc-290--volkanovski-rodriguez-020234533.html
5,Big 12 preseason poll: Texas is significant favorite to win conference title before SEC exitYahoo Sports,https://sports.yahoo.com/big-12-preseason-poll-texas-is-significant-favorite-to-win-conference-title-before-sec-exit-193212743.html
6,"UFC 290: Alex Volkanovski loves being a champion, loves talking about fighting and especially loves mega-fightsYahoo Sports",https://sports.yahoo.com/ufc-290-alex-volkanovski-loves-being-a-champion-loves-talking-about-fighting-and-especially-loves-mega-fights-193221485.html
7,Wimbledon Day 4: UK's Liam Broady beats No. 4 Casper Ruud and No. 9 Taylor Fritz falls as upsets shake up tournamentYahoo Sports,https://sports.yahoo.com/wimbledon-day-4-uks-liam-broady-beats-no-4-casper-ruud-and-no-9-taylor-fritz-falls-as-upsets-shake-up-tournament-182132387.html
8,Women's World Cup 2023: 15 must-watch playersYahoo Sports,https://sports.yahoo.com/womens-world-cup-2023-15-must-watch-players-180006148.html
9,Vergil Ortiz pulls out of bout with Eimantas Stanionis for a 3rd time after reportedly faintingYahoo Sports,https://sports.yahoo.com/vergil-ortiz-pulls-out-of-bout-with-eimantas-stanionis-for-a-3rd-time-after-reportedly-fainting-173016097.html
10,YES Network cameraman hospitalized after hit in head by errant throw at Yankee StadiumYahoo Sports,https://sports.yahoo.com/yes-network-cameraman-hospitalized-after-hit-in-head-by-errant-throw-at-yankee-stadium-034905413.html
11,Los Angeles Dodgers' young pitchers will be put to the test as injuries mountYahoo Sports,https://sports.yahoo.com/los-angeles-dodgers-young-pitchers-will-be-put-to-the-test-as-injuries-mount-064827118.html
12,2023 NFL Preview: Packers turn the page from Aaron Rodgers to Jordan LoveYahoo Sports,https://sports.yahoo.com/2023-nfl-preview-packers-turn-the-page-from-aaron-rodgers-to-jordan-love-104541445.html
13,UFC 290: How to bet Brandon Moreno-Alexandre Pantoja co-main eventYahoo Sports,https://sports.yahoo.com/ufc-290-how-to-bet-brandon-moreno-alexandre-pantoja-co-main-event-133141889.html
14,Recapping college football's busy offseason of quarterback transfersYahoo Sports,https://sports.yahoo.com/recapping-college-footballs-busy-offseason-of-quarterback-transfers-131501633.html
15,Reports: Grant Williams leaving Celtics for Mavericks via $53 million sign-and-trade dealYahoo Sports,https://sports.yahoo.com/reports-grant-williams-leaving-celtics-for-mavericks-via-53-million-sign-and-trade-deal-231412743.html
16,"Victor Wembanyama will reportedly make Spurs debut vs. Brandon Miller, Hornets at NBA Summer LeagueYahoo Sports",https://sports.yahoo.com/victor-wembanyama-will-reportedly-make-spurs-debut-vs-brandon-miller-hornets-at-nba-summer-league-215530235.html
17,"MLB's Home Run Derby field is set, featuring Julio Rodríguez vs. Pete Alonso rematch in SeattleYahoo Sports",https://sports.yahoo.com/mlbs-home-run-derby-field-is-set-featuring-julio-rodriguez-vs-pete-alonso-rematch-in-seattle-004216301.html
18,"With NBA’s moratorium lifting, league’s focus now shifts to restricted free agentsYahoo Sports",https://sports.yahoo.com/with-nbas-moratorium-lifting-leagues-focus-now-shifts-to-restricted-free-agents-215641767.html
19,"Outgoing NFLPA chief calls for NFL to eliminate Rooney Rule, proposes sweeping changes to hiring practicesYahoo Sports",https://sports.yahoo.com/outgoing-nflpa-chief-calls-for-nfl-to-eliminate-rooney-rule-proposes-sweeping-changes-to-hiring-practices-031026409.html
20,Marlins stun Cardinals with wild win after pitcher Jordan Hicks’ brutal errorYahoo Sports,https://sports.yahoo.com/marlins-stun-cardinals-with-wild-win-after-pitcher-jordan-hicks-brutal-error-024817366.html
21,Here's what an NBA technical foul for flopping looks likeYahoo Sports,https://sports.yahoo.com/heres-what-an-nba-technical-foul-for-flopping-looks-like-020056333.html
22,"NBA free agency 2023 tracker: Blazers match Matisse Thybulle's offer sheet; latest news, rumors, tradesYahoo Sports",https://sports.yahoo.com/nba-free-agency-2023-tracker-blazers-match-matisse-thybulles-offer-sheet-latest-news-rumors-trades-171026664.html
23,"Reds star Elly De La Cruz’s bat checked by umpires over tracking sensor cover, briefly removed vs. NationalsYahoo Sports",https://sports.yahoo.com/reds-star-elly-de-la-cruzs-bat-checked-by-umpires-over-tracking-sensor-cover-briefly-removed-vs-nationals-010620582.html
24,"Ex-Florida QB Jalen Kitna has child porn charges dropped in plea deal, sentenced to probationYahoo Sports",https://sports.yahoo.com/ex-florida-qb-jalen-kitna-has-child-porn-charges-dropped-in-plea-deal-sentenced-to-probation-233536168.html
25,NBA's new in-season tournament to reportedly debut in DecemberYahoo Sports,https://sports.yahoo.com/nbas-new-in-season-tournament-to-reportedly-debut-in-december-231932960.html
26,Yankees P Jimmy Cordero suspended for rest of season for violating MLB's domestic violence policyYahoo Sports,https://sports.yahoo.com/yankees-p-jimmy-cordero-suspended-for-rest-of-season-for-violating-mlbs-domestic-violence-policy-180441532.html
27,Why Damian Lillard makes so much sense for the Miami HeatYahoo Sports,https://sports.yahoo.com/why-damian-lillard-makes-so-much-sense-for-the-miami-heat-144646247.html
28,"Peach Jam: Cooper Flagg, Maine United upset Cameron Boozer, NightrydasYahoo Sports",https://sports.yahoo.com/peach-jam-cooper-flagg-maine-united-upset-cameron-boozer-nightrydas-154836275.html
29,Giannis Antetokounmpo reportedly had knee surgery to clean up loose cartilageYahoo Sports,https://sports.yahoo.com/giannis-antetokounmpo-reportedly-had-knee-surgery-to-clean-up-loose-cartilage-174232013.html
30,2023 Fantasy Football Notebook: Christian Watson hype opens door for bust potentialYahoo Sports,https://sports.yahoo.com/2023-fantasy-football-notebook-christian-watson-hype-opens-door-for-bust-potential-165755281.html
31,Riqui Puig's star turn in El Trafico at Rose Bowl a reminder of LA Galaxy's potentialYahoo Sports,https://sports.yahoo.com/riqui-puigs-star-turn-in-el-trafico-at-rose-bowl-a-reminder-of-la-galaxys-potential-194957442.html
32,PSG gives Mbappé 2 weeks to decide on his futureYahoo Sports,https://sports.yahoo.com/psg-gives-kylian-mbappe-2-weeks-to-decide-on-his-future-we-want-him-to-stay-but-he-cant-leave-for-free-185349848.html
33,Magic promote Anthony Parker to GM as John Hammond transitions into senior advisory roleYahoo Sports,https://sports.yahoo.com/magic-promote-anthony-parker-to-gm-as-john-hammond-transitions-into-senior-advisory-role-180800406.html
34,"How to watch NBA summer league games, schedule, Wembanyama updates, streaming info and moreYahoo Sports",https://sports.yahoo.com/nbawatch-summer-league-wembanyama-spurs-schedule-141424983.html
35,"Shohei Ohtani, Anthony Rendon exit early after Mike Trout hits IL in nightmare day for AngelsYahoo Sports",https://sports.yahoo.com/shohei-ohtani-anthony-rendon-exit-early-after-mike-trout-hits-il-in-nightmare-day-for-angels-020127878.html
36,Does this offseason indicate the NFL running back market has seen its last true reset?Yahoo Sports,https://sports.yahoo.com/does-this-offseason-indicate-the-nfl-running-back-market-has-seen-its-last-true-reset-142504947.html
37,Formula 1 unveils 24-race schedule for 2024Yahoo Sports,https://sports.yahoo.com/formula-1-unveils-24-race-schedule-for-2024-140107785.html
38,Women’s World Cup 2023: Power ranking the 11 true contendersYahoo Sports,https://sports.yahoo.com/womens-world-cup-2023-power-ranking-the-11-true-contenders-120008671.html
39,"LA Galaxy upset LAFC in front of electric, record-breaking Rose Bowl crowdYahoo Sports",https://sports.yahoo.com/la-galaxy-upset-lafc-in-front-of-electric-record-breaking-rose-bowl-crowd-045437460.html
40,"Dodgers P Dustin May to undergo flexor tendon surgery, likely out for seasonYahoo Sports",https://sports.yahoo.com/dodgers-p-dustin-may-to-undergo-flexor-tendon-surgery-likely-out-for-season-004527497.html
41,2023 NFL Preview: Falcons embrace their run-first approach with Bijan Robinson pickYahoo Sports,https://sports.yahoo.com/2023-nfl-preview-falcons-embrace-their-run-first-approach-with-bijan-robinson-pick-124945989.html
42,Joey Chestnut wins 16th Nathan’s Famous Hot Dog Eating Contest after 2-hour weather delayYahoo Sports,https://sports.yahoo.com/joey-chestnut-wins-16th-nathans-famous-hot-dog-eating-contest-after-2-hour-weather-delay-190303905.html
43,NBA free agency 2023: Anthony Edwards agrees to max extension with Minnesota TimberwolvesYahoo Sports,https://sports.yahoo.com/nba-free-agency-2023-anthony-edwards-agrees-to-max-extension-with-timberwolves-162957602.html
44,Former NFL RB Corey Dillon says he deserves to be in Hall of Fame: 'Because I earned it'Yahoo Sports,https://sports.yahoo.com/former-nfl-rb-corey-dillon-says-he-deserves-to-be-in-hall-of-fame-because-i-earned-it-153448821.html
45,Fantasy Football 2023: Are these early ADPs just right or way off?Yahoo Sports,https://sports.yahoo.com/fantasy-football-2023-are-these-early-adps-just-right-or-way-off-192636559.html
46,"Former top prospect Filip Zadina, Red Wings 'mutually' terminate contract in rare moveYahoo Sports Canada",https://sports.yahoo.com/nhl-filip-zadina-red-wings-mutually-terminate-contract-in-rare-move-184727233.html
47,"San Diego State stays in Mountain West, Trent Dilfer speaks out on poaching players & is Coach Prime at Colorado a lose-lose?Yahoo Sports",https://sports.yahoo.com/san-diego-state-stays-in-mountain-west-trent-dilfer-speaks-out-on-poaching-players--is-coach-prime-at-colorado-a-lose-lose-210140235.html
48,Penguins' Kyle Dubas era off to dubious start in NHL free agencyYahoo Sports Canada,https://sports.yahoo.com/nhl-free-agency-penguins-kyle-dubas-era-off-to-dubious-start-125053695.html
49,Fantasy Baseball infield rest-of-season rankings tiersYahoo Sports,https://sports.yahoo.com/fantasy-baseball-infield-rest-of-season-rankings-tiers-171716107.html
